{
  "$schema_version": "semantic-secrets-concept-catalog-v1",
  "catalog_id": "controlled-pilot-v1",
  "ontology_id": "controlled-ontology-v1",
  "audit_status": "blind-audit-complete",
  "families": [
    {
      "family_id": "f001",
      "complexity_level": 1,
      "frequency_band": "common_candidate",
      "base": {
        "concept_id": "c001a",
        "prompts": {
          "canonical": "A single scooter on a plain neutral background.",
          "paraphrase_1": "One scooter shown alone against a neutral background.",
          "paraphrase_2": "A neutral scene containing exactly one scooter and nothing else prominent."
        },
        "atoms": [
          {
            "type": "object",
            "id": "scooter",
            "value": "scooter"
          }
        ]
      },
      "near_neighbours": [
        {
          "concept_id": "c001b",
          "prompts": {
            "canonical": "A single moped on a plain neutral background.",
            "paraphrase_1": "One moped shown alone against a neutral background.",
            "paraphrase_2": "A neutral scene containing exactly one moped and nothing else prominent."
          },
          "atoms": [
            {
              "type": "object",
              "id": "moped",
              "value": "moped"
            }
          ],
          "change": {
            "atom_type": "object",
            "from_signature": "object|id=scooter|value=scooter",
            "to_signature": "object|id=moped|value=moped"
          }
        }
      ],
      "audit_notes": "Pilot authoring cycle 1; transformed audited template f001 with one object replacement."
    },
    {
      "family_id": "f002",
      "complexity_level": 2,
      "frequency_band": "common_candidate",
      "base": {
        "concept_id": "c002a",
        "prompts": {
          "canonical": "A rabbit wearing a black hat.",
          "paraphrase_1": "A black hat is wrapped around a rabbit.",
          "paraphrase_2": "One rabbit with a clearly visible black hat."
        },
        "atoms": [
          {
            "type": "object",
            "id": "rabbit",
            "value": "rabbit"
          },
          {
            "type": "attribute",
            "subject": "rabbit",
            "subtype": "colour",
            "value": "black"
          }
        ]
      },
      "near_neighbours": [
        {
          "concept_id": "c002b",
          "prompts": {
            "canonical": "A rabbit wearing a white hat.",
            "paraphrase_1": "A white hat is wrapped around a rabbit.",
            "paraphrase_2": "One rabbit with a clearly visible white hat."
          },
          "atoms": [
            {
              "type": "object",
              "id": "rabbit",
              "value": "rabbit"
            },
            {
              "type": "attribute",
              "subject": "rabbit",
              "subtype": "colour",
              "value": "white"
            }
          ],
          "change": {
            "atom_type": "attribute",
            "from_signature": "attribute|subject=rabbit|value=black|subtype=colour",
            "to_signature": "attribute|subject=rabbit|value=white|subtype=colour"
          }
        }
      ],
      "audit_notes": "Pilot authoring cycle 1; transformed audited template f002 with one attribute replacement."
    },
    {
      "family_id": "f003",
      "complexity_level": 2,
      "frequency_band": "common_candidate",
      "base": {
        "concept_id": "c003a",
        "prompts": {
          "canonical": "Exactly two rabbits together on a plain background.",
          "paraphrase_1": "A plain scene showing a pair of rabbits together.",
          "paraphrase_2": "Two rabbits, and not any additional rabbits, grouped together."
        },
        "atoms": [
          {
            "type": "object",
            "id": "rabbit",
            "value": "rabbit"
          },
          {
            "type": "count",
            "subject": "rabbit",
            "value": "2"
          }
        ]
      },
      "near_neighbours": [
        {
          "concept_id": "c003b",
          "prompts": {
            "canonical": "Exactly three rabbits together on a plain background.",
            "paraphrase_1": "A plain scene showing a group of three rabbits together.",
            "paraphrase_2": "Three rabbits, and not any additional rabbits, grouped together."
          },
          "atoms": [
            {
              "type": "object",
              "id": "rabbit",
              "value": "rabbit"
            },
            {
              "type": "count",
              "subject": "rabbit",
              "value": "3"
            }
          ],
          "change": {
            "atom_type": "count",
            "from_signature": "count|subject=rabbit|value=2",
            "to_signature": "count|subject=rabbit|value=3"
          }
        }
      ],
      "audit_notes": "Pilot authoring cycle 1; transformed audited template f003 with one count replacement."
    },
    {
      "family_id": "f004",
      "complexity_level": 3,
      "frequency_band": "common_candidate",
      "base": {
        "concept_id": "c004a",
        "prompts": {
          "canonical": "A fox catching a flying ball.",
          "paraphrase_1": "A ball is in the air as a fox catches it.",
          "paraphrase_2": "One fox in the act of catching one ball."
        },
        "atoms": [
          {
            "type": "object",
            "id": "fox",
            "value": "fox"
          },
          {
            "type": "object",
            "id": "ball",
            "value": "ball"
          },
          {
            "type": "action",
            "subject": "fox",
            "value": "catch",
            "object": "ball"
          }
        ]
      },
      "near_neighbours": [
        {
          "concept_id": "c004b",
          "prompts": {
            "canonical": "A fox carrying a ball.",
            "paraphrase_1": "A fox moves while carrying one ball.",
            "paraphrase_2": "One fox in the act of carrying one ball."
          },
          "atoms": [
            {
              "type": "object",
              "id": "fox",
              "value": "fox"
            },
            {
              "type": "object",
              "id": "ball",
              "value": "ball"
            },
            {
              "type": "action",
              "subject": "fox",
              "value": "carry",
              "object": "ball"
            }
          ],
          "change": {
            "atom_type": "action",
            "from_signature": "action|subject=fox|value=catch|object=ball",
            "to_signature": "action|subject=fox|value=carry|object=ball"
          }
        }
      ],
      "audit_notes": "Pilot authoring cycle 1; transformed audited template f004 with one action replacement."
    },
    {
      "family_id": "f005",
      "complexity_level": 3,
      "frequency_band": "common_candidate",
      "base": {
        "concept_id": "c005a",
        "prompts": {
          "canonical": "A lamp positioned to the left of a chair.",
          "paraphrase_1": "A chair with a lamp clearly placed on its left side.",
          "paraphrase_2": "The lamp is left of the chair, with both fully visible."
        },
        "atoms": [
          {
            "type": "object",
            "id": "lamp",
            "value": "lamp"
          },
          {
            "type": "object",
            "id": "chair",
            "value": "chair"
          },
          {
            "type": "relation",
            "subject": "lamp",
            "value": "left_of",
            "object": "chair"
          }
        ]
      },
      "near_neighbours": [
        {
          "concept_id": "c005b",
          "prompts": {
            "canonical": "A lamp positioned to the right of a chair.",
            "paraphrase_1": "A chair with a lamp clearly placed on its right side.",
            "paraphrase_2": "The lamp is right of the chair, with both fully visible."
          },
          "atoms": [
            {
              "type": "object",
              "id": "lamp",
              "value": "lamp"
            },
            {
              "type": "object",
              "id": "chair",
              "value": "chair"
            },
            {
              "type": "relation",
              "subject": "lamp",
              "value": "right_of",
              "object": "chair"
            }
          ],
          "change": {
            "atom_type": "relation",
            "from_signature": "relation|subject=lamp|value=left_of|object=chair",
            "to_signature": "relation|subject=lamp|value=right_of|object=chair"
          }
        }
      ],
      "audit_notes": "Pilot authoring cycle 1; transformed audited template f005 with one relation replacement."
    },
    {
      "family_id": "f006",
      "complexity_level": 2,
      "frequency_band": "mid_candidate",
      "base": {
        "concept_id": "c006a",
        "prompts": {
          "canonical": "A canoe at sea in a coastal sunrise scene.",
          "paraphrase_1": "Sunrise over the coast with one canoe on the water.",
          "paraphrase_2": "One canoe offshore as the coastal sun rises."
        },
        "atoms": [
          {
            "type": "object",
            "id": "canoe",
            "value": "canoe"
          },
          {
            "type": "scene",
            "value": "coastal_sunrise"
          }
        ]
      },
      "near_neighbours": [
        {
          "concept_id": "c006b",
          "prompts": {
            "canonical": "A canoe at sea in a coastal night scene.",
            "paraphrase_1": "Night over the coast with one canoe on the water.",
            "paraphrase_2": "One canoe offshore along the coast at night."
          },
          "atoms": [
            {
              "type": "object",
              "id": "canoe",
              "value": "canoe"
            },
            {